{
  "id": "dianping-city",
  "url": "https://www.dianping.com/",
  "settings": {
    "browserName": "chrome",
    "device": {
      "userAgent": "Mozilla/5.0 (Windows NT 10.0; Win64; x64) AppleWebKit/537.36 (KHTML, like Gecko) Chrome/112.0.0.0 Safari/537.36"
    },
    "arguments": ["--headless=new", "--no-sandbox"]
  },
  "steps": [
    {
      "name": "注入cookie",
      "type": "action",
      "actionName": "+cookies",
      "cookies": "${cookie}"
    },
    {
      "id": "locate-switch-city",
      "name": "定位更换城市",
      "type": "locator",
      "selector": "#top-nav > div.top-nav-container.clearfix > div.group.J-city-select > a > span.J-city-change"
    },
    {
      "id": "switch-city",
      "name": "切换城市",
      "type": "action",
      "actionName": "click",
      "target": "locate-switch-city"
    },
    {
      "id": "locate-more-city",
      "name": "定位更多城市",
      "type": "locator",
      "selector": "#top-nav > div.top-nav-container.clearfix > div.group.J-city-select > div > a"
    },
    {
      "id": "more-city",
      "name": "选择更多城市",
      "type": "action",
      "actionName": "click",
      "target": "locate-more-city",
      "hint": "navigate to url: https://www.dianping.com/citylist"
    },
    {
      "id": "locate-city-list",
      "name": "定位城市列表",
      "type": "locator",
      "selector": "#main > div.main-citylist > ul > li",
      "multi": true
    },
    {
      "id": "compose-city-list",
      "name": "获取城市列表",
      "type": "box",
      "target": "locate-city-list",
      "outputPropertyName": "$",
      "wrap": false,
      "steps": [
        {
          "id": "locate-more",
          "name": "定位更多：展开按字母排序下该字母开头的所有城市",
          "type": "locator",
          "selector": "span.more"
        },
        {
          "name": "点击更多",
          "type": "action",
          "actionName": "click",
          "target": "locate-more"
        },
        {
          "id": "locate-city",
          "name": "定位城市元素",
          "type": "locator",
          "selector": "div.terms > div > a",
          "multi": true
        },
        {
          "id": "get-city-info",
          "name": "获取城市信息",
          "type": "box",
          "target": "locate-city",
          "wrap": true,
          "steps": [
            {
              "name": "获取城市拼音: //www.dianping.com/{cityPinyinSpelling}/ch0",
              "type": "finder",
              "outputPropertyName": "cityPinyinSpelling",
              "valueGetter": "attribute",
              "attributeKey": "href",
              "valueConverter": "arg.split(\"/\")[3]"
            },
            {
              "name": "获取城市中文名称",
              "type": "finder",
              "outputPropertyName": "cityName",
              "valueGetter": "text"
            },
            {
              "id": "locate-clickable",
              "name": "定位当前元素",
              "type": "locator",
              "xpath": "."
            },
            {
              "id": "city-dianping",
              "name": "点击城市专属页面",
              "type": "action",
              "actionName": "click",
              "target": "locate-clickable"
            },
            {
              "id": "switch-to-city",
              "name": "切换城市专属页面",
              "type": "action",
              "actionName": "switch",
              "target": "city-dianping"
            },
            {
              "name": "获取城市id: https://www.dianping.com/shopall/{cityId}/0",
              "type": "finder",
              "selector": "#cata-hot > div > div > a",
              "outputPropertyName": "cityId",
              "valueGetter": "attribute",
              "attributeKey": "href",
              "valueConverter": "arg.split(\"/\")[4]"
            },
            {
              "name": "关闭城市专属页面",
              "type": "action",
              "actionName": "close",
              "target": "city-dianping"
            }
          ]
        },
        {
          "id": "locate-less-city",
          "name": "定位收起：收起按字母排序下的部分城市",
          "type": "locator",
          "selector": "span.up"
        },
        {
          "name": "收起城市",
          "type": "action",
          "actionName": "click",
          "target": "locate-less-city"
        }
      ]
    }
  ]
}